{
  "$schema": "http://json-schema.org/draft-07/schema#",
  "title": "host-result-v1",
  "type": "object",
  "additionalProperties": false,
  "required": ["schema", "schema_version", "run_id", "inspection_id", "host", "collected_at", "duration_sec", "execution_status", "execution_summary", "metrics", "meta"],
  "properties": {
    "schema": { "const": "host-result-v1" },
    "schema_version": { "const": 1 },
    "run_id": { "type": "string", "minLength": 1 },
    "inspection_id": { "type": "string", "pattern": "^insp-[0-9]{14}-[A-Za-z0-9_.-]+$" },
    "host": {
      "type": "object", "additionalProperties": false,
      "required": ["name", "ip", "inventory_source"],
      "properties": {
        "name": { "type": "string", "minLength": 1 },
        "ip": { "type": "string", "minLength": 1 },
        "inventory_source": { "type": "string", "minLength": 1 },
        "product_profiles": { "type": "array", "items": { "type": "string" } }
      }
    },
    "collected_at": { "type": "string", "pattern": "^[0-9]{4}-[0-9]{2}-[0-9]{2}T" },
    "duration_sec": { "type": "number", "minimum": 0 },
    "execution_status": { "enum": ["SUCCESS", "PARTIAL", "ERROR"] },
    "execution_summary": {
      "type": "object", "additionalProperties": false,
      "required": ["total_metrics", "ok", "warn", "crit", "unknown", "executed", "failed"],
      "properties": {
        "total_metrics": { "type": "integer", "minimum": 0 },
        "ok": { "type": "integer", "minimum": 0 },
        "warn": { "type": "integer", "minimum": 0 },
        "crit": { "type": "integer", "minimum": 0 },
        "unknown": { "type": "integer", "minimum": 0 },
        "executed": { "type": "integer", "minimum": 0 },
        "failed": { "type": "integer", "minimum": 0 }
      }
    },
    "metrics": { "type": "array", "items": { "$ref": "#/definitions/metric" } },
    "meta": {
      "type": "object", "additionalProperties": false,
      "required": ["control_endpoint", "gather_facts", "serial", "become_scope", "generator", "generator_version"],
      "properties": {
        "control_endpoint": { "const": "Linux/WSL Python3" },
        "gather_facts": { "const": false },
        "serial": { "const": 1 },
        "become_scope": { "const": "minimal" },
        "generator": { "const": "inspect.sh" },
        "generator_version": { "type": "string", "minLength": 1 }
      }
    }
  },
  "definitions": {
    "metric": {
      "type": "object", "additionalProperties": false,
      "required": ["metric_id", "name", "scope", "status", "raw_value", "unit", "threshold", "evidence", "provenance"],
      "properties": {
        "metric_id": { "type": "string", "pattern": "^local\\." },
        "name": { "type": "string", "minLength": 1 },
        "scope": { "type": "string", "minLength": 1 },
        "status": { "enum": ["OK", "WARN", "CRIT", "UNKNOWN"] },
        "raw_value": { "type": ["string", "number", "boolean", "null"] },
        "normalized_value": { "type": ["number", "null"] },
        "unit": { "type": "string", "minLength": 1 },
        "threshold": { "$ref": "#/definitions/threshold" },
        "evidence": { "$ref": "#/definitions/evidence" },
        "error": { "anyOf": [{ "type": "null" }, { "$ref": "#/definitions/error" }] },
        "provenance": { "$ref": "#/definitions/provenance" }
      }
    },
    "threshold": {
      "type": "object", "additionalProperties": false,
      "required": ["layer", "rule_id", "value", "source_anchor"],
      "properties": {
        "layer": { "enum": ["document-baseline", "external-config", "unresolved-document-conflict", null] },
        "rule_id": { "type": ["string", "null"] },
        "value": { "type": ["string", "number", "null"] },
        "source_anchor": { "type": ["string", "null"] },
        "notes": { "type": ["string", "null"] }
      }
    },
    "evidence": {
      "type": "object", "additionalProperties": false,
      "required": ["command", "output_summary", "sampled_at"],
      "properties": {
        "command": { "type": "string" },
        "output_summary": { "type": ["string", "null"] },
        "raw_ref": { "type": ["string", "null"] },
        "sampled_at": { "type": ["string", "null"] }
      }
    },
    "error": {
      "type": "object", "additionalProperties": false,
      "required": ["code", "message", "metric_status"],
      "properties": {
        "code": { "enum": ["CONNECTION_FAILED", "TIMEOUT", "PERMISSION_DENIED", "COMMAND_NOT_FOUND", "PARSE_FAILED", "DATA_MISSING", "PROBE_FAILED", "UNSUPPORTED_PROFILE"] },
        "message": { "type": "string" },
        "metric_status": { "const": "UNKNOWN" }
      }
    },
    "provenance": {
      "type": "object", "additionalProperties": false,
      "required": ["config_sources", "doc_sources"],
      "properties": {
        "config_sources": { "type": "array", "items": { "type": "string" } },
        "doc_sources": { "type": "array", "items": { "type": "string" } },
        "notes": { "type": ["string", "null"] }
      }
    }
  }
}
